<?xml version="1.0" encoding="UTF-8"?>
<interesovanje xmlns="https://www.vakcinacija.rs/interesovanje"
    xmlns:xsi="http://www.w3.org/2001/XMLSchema-instance"
    xmlns:za="https://www.vakcinacija.rs/zajednicko"
    xsi:schemaLocation="http://www.vakcinacija.rs/interesovanje ../xsd/interesovanje.xsd">
    <licne_informacije>
        <drzavljanstvo>DRZAVLJANIN_REPUBLIKE_SRBIJE</drzavljanstvo>
        <jmbg>3101000230504</jmbg>
        <kontakt>
            <za:broj_fiksnog>021123123</za:broj_fiksnog>
            <za:broj_mobilnog >060721321</za:broj_mobilnog>
            <za:email >marko@gmail.com</za:email>
        </kontakt>
        <puno_ime>
            <za:ime>Rastko</za:ime>
            <za:prezime>Petrovic</za:prezime>
        </puno_ime>
        <davalac_krvi>true</davalac_krvi>
    </licne_informacije>
    <odabrana_lokacija_primanja_vakcine></odabrana_lokacija_primanja_vakcine>
    <odabrani_proizvodjaci>
        <proizvodjac>Bilo koja</proizvodjac>
    </odabrani_proizvodjaci>
</interesovanje>